3,Xen and the Art of Surviving Graduate School,5,2019-04-23 13:53:34.278318
3,Xen and the Art of Surviving Graduate School,5,2019-04-23 13:55:04.053081
4,Cooking for the Impatient Graduate Student,12,23-Apr-2019 (19:15:17.745265)
4,Cooking for the Impatient Graduate Student,12,23-Apr-2019 (19:17:28.128641)
1,How to get a good grade in 677 in 20 minutes a day,10,23-Apr-2019 (19:19:46.100228)
3,Xen and the Art of Surviving Graduate School,5,23-Apr-2019 (19:19:56.274560)
5,How to finish Project 3 on time,25,23-Apr-2019 (19:20:02.838815)
